{
  "apiVersion": "ohmy.dev/v0alpha1",
  "sources": [
    {
      "id": "ohmy-local",
      "url": null,
      "author": "Oh My Grok Bot project",
      "license": "Project code UNLICENSED; adapted Skills individually MIT and/or Apache-2.0, see their notices",
      "redistribution": "local_only",
      "verification": "reviewed",
      "checkedAt": "2026-10-14"
    },
    {
      "id": "grokbot-docs",
      "url": "https://docs.x.ai/grok-bot/bots",
      "author": "Grok Bot documentation",
      "license": "Reference only; upstream terms apply",
      "redistribution": "reference_only",
      "verification": "reviewed",
      "checkedAt": "2026-10-14"
    },
    {
      "id": "lark-channel-sdk",
      "url": "https://github.com/larksuite/channel-sdk-node",
      "author": "larksuite",
      "license": "MIT (repository; pinned release review still required)",
      "redistribution": "reference_only",
      "verification": "reviewed",
      "checkedAt": "2026-10-14"
    },
    {
      "id": "x-api-docs",
      "url": "https://docs.x.com/x-api/posts/search-recent-posts",
      "author": "x official platform documentation",
      "license": "Reference only; upstream service terms apply",
      "redistribution": "reference_only",
      "verification": "reviewed",
      "checkedAt": "2026-10-14"
    },
    {
      "id": "bluesky-api-docs",
      "url": "https://github.com/bluesky-social/atproto",
      "author": "bluesky official platform documentation",
      "license": "Reference only; upstream service terms apply",
      "redistribution": "reference_only",
      "verification": "reviewed",
      "checkedAt": "2026-10-14"
    },
    {
      "id": "mastodon-api-docs",
      "url": "https://docs.joinmastodon.org/methods/search/",
      "author": "mastodon official platform documentation",
      "license": "Reference only; upstream service terms apply",
      "redistribution": "reference_only",
      "verification": "reviewed",
      "checkedAt": "2026-10-14"
    },
    {
      "id": "youtube-api-docs",
      "url": "https://developers.google.com/youtube/v3/docs/search/list",
      "author": "youtube official platform documentation",
      "license": "Reference only; upstream service terms apply",
      "redistribution": "reference_only",
      "verification": "reviewed",
      "checkedAt": "2026-10-14"
    },
    {
      "id": "threads-api-docs",
      "url": "https://developers.facebook.com/docs/threads/",
      "author": "threads official platform documentation",
      "license": "Reference only; upstream service terms apply",
      "redistribution": "reference_only",
      "verification": "reviewed",
      "checkedAt": "2026-10-14"
    },
    {
      "id": "instagram-api-docs",
      "url": "https://developers.facebook.com/docs/instagram-platform/",
      "author": "instagram official platform documentation",
      "license": "Reference only; upstream service terms apply",
      "redistribution": "reference_only",
      "verification": "reviewed",
      "checkedAt": "2026-10-14"
    },
    {
      "id": "facebook-api-docs",
      "url": "https://developers.facebook.com/docs/pages-api/",
      "author": "facebook official platform documentation",
      "license": "Reference only; upstream service terms apply",
      "redistribution": "reference_only",
      "verification": "reviewed",
      "checkedAt": "2026-10-14"
    },
    {
      "id": "linkedin-api-docs",
      "url": "https://learn.microsoft.com/en-us/linkedin/marketing/community-management/shares/posts-api",
      "author": "linkedin official platform documentation",
      "license": "Reference only; upstream service terms apply",
      "redistribution": "reference_only",
      "verification": "reviewed",
      "checkedAt": "2026-10-14"
    },
    {
      "id": "tiktok-api-docs",
      "url": "https://developers.tiktok.com/docs/en/content-posting-api-get-started",
      "author": "tiktok official platform documentation",
      "license": "Reference only; upstream service terms apply",
      "redistribution": "reference_only",
      "verification": "reviewed",
      "checkedAt": "2026-10-14"
    },
    {
      "id": "agency-agents",
      "url": "https://github.com/msitarzewski/agency-agents",
      "author": "msitarzewski",
      "license": "MIT. Role-card structure only; no upstream prompt files are copied.",
      "redistribution": "reference_only",
      "verification": "reviewed",
      "checkedAt": "2026-10-15"
    },
    {
      "id": "wshobson-agents",
      "url": "https://github.com/wshobson/agents",
      "author": "wshobson",
      "license": "MIT. Composition pattern only; its plugin marketplace is not installed.",
      "redistribution": "reference_only",
      "verification": "reviewed",
      "checkedAt": "2026-10-15"
    },
    {
      "id": "crewai-examples",
      "url": "https://github.com/crewAIInc/crewAI-examples",
      "author": "crewAIInc",
      "license": "No LICENSE file found on 2026-10-15. Treat as all rights reserved; do not copy examples.",
      "redistribution": "reference_only",
      "verification": "reviewed",
      "checkedAt": "2026-10-15"
    },
    {
      "id": "oh-my-openagent",
      "url": "https://github.com/code-yeongyu/oh-my-openagent",
      "author": "code-yeongyu",
      "license": "Sustainable Use License 1.0. Non-sublicensable; no files copied.",
      "redistribution": "reference_only",
      "verification": "reviewed",
      "checkedAt": "2026-10-15"
    },
    {
      "id": "open-deep-research",
      "url": "https://github.com/langchain-ai/open_deep_research",
      "author": "langchain-ai",
      "license": "MIT. Optional external engine; LangGraph service is not vendored.",
      "redistribution": "reference_only",
      "verification": "reviewed",
      "checkedAt": "2026-10-15"
    },
    {
      "id": "gpt-researcher",
      "url": "https://github.com/assafelovic/gpt-researcher",
      "author": "assafelovic",
      "license": "Apache-2.0. Optional external research service; server is not embedded.",
      "redistribution": "reference_only",
      "verification": "reviewed",
      "checkedAt": "2026-10-15"
    },
    {
      "id": "browser-use",
      "url": "https://github.com/browser-use/browser-use",
      "author": "browser-use",
      "license": "MIT. Authorized browser automation only; cookies are not stored in packs.",
      "redistribution": "reference_only",
      "verification": "reviewed",
      "checkedAt": "2026-10-15"
    },
    {
      "id": "openhands-sdk",
      "url": "https://github.com/OpenHands/software-agent-sdk",
      "author": "OpenHands",
      "license": "MIT. External coding workspace only; SDK is not embedded.",
      "redistribution": "reference_only",
      "verification": "reviewed",
      "checkedAt": "2026-10-15"
    },
    {
      "id": "video-use",
      "url": "https://github.com/browser-use/video-use",
      "author": "browser-use",
      "license": "MIT. Optional local media CLI; binary is not bundled.",
      "redistribution": "reference_only",
      "verification": "reviewed",
      "checkedAt": "2026-10-15"
    },
    {
      "id": "remotion",
      "url": "https://github.com/remotion-dev/remotion",
      "author": "remotion-dev",
      "license": "Custom Remotion license, not MIT or Apache-2.0. Company license may be required. Do not copy.",
      "redistribution": "reference_only",
      "verification": "reviewed",
      "checkedAt": "2026-10-15"
    },
    {
      "id": "ai-hedge-fund",
      "url": "https://github.com/virattt/ai-hedge-fund",
      "author": "virattt",
      "license": "MIT research and simulation project. Not a broker. No live orders.",
      "redistribution": "reference_only",
      "verification": "reviewed",
      "checkedAt": "2026-10-16"
    },
    {
      "id": "trading-agents",
      "url": "https://github.com/TauricResearch/TradingAgents",
      "author": "TauricResearch",
      "license": "Apache-2.0 research collaboration. No live orders or brokerage credentials.",
      "redistribution": "reference_only",
      "verification": "reviewed",
      "checkedAt": "2026-10-16"
    },
    {
      "id": "composio",
      "url": "https://github.com/ComposioHQ/composio",
      "author": "ComposioHQ",
      "license": "MIT. Third-party OAuth stays in the operator secret store. SDK is not copied.",
      "redistribution": "reference_only",
      "verification": "reviewed",
      "checkedAt": "2026-10-15"
    },
    {
      "id": "activepieces",
      "url": "https://github.com/activepieces/activepieces",
      "author": "activepieces",
      "license": "Core MIT; enterprise directories use a separate license. Server is not vendored.",
      "redistribution": "reference_only",
      "verification": "reviewed",
      "checkedAt": "2026-10-15"
    },
    {
      "id": "comfyui",
      "url": "https://github.com/Comfy-Org/ComfyUI",
      "author": "Comfy-Org",
      "license": "GPL-3.0. Do not copy source into this distribution.",
      "redistribution": "reference_only",
      "verification": "reviewed",
      "checkedAt": "2026-10-15"
    },
    {
      "id": "wewrite",
      "url": "https://github.com/imraywang/wewrite",
      "author": "imraywang",
      "license": "MIT. Writing-stage structure only; no skill text copied.",
      "redistribution": "reference_only",
      "verification": "reviewed",
      "checkedAt": "2026-10-15"
    },
    {
      "id": "wechat-article-skills",
      "url": "https://github.com/aiworkskills/wechat-article-skills",
      "author": "aiworkskills",
      "license": "Apache-2.0. Human-confirmation publishing flow only; no skill text copied.",
      "redistribution": "reference_only",
      "verification": "reviewed",
      "checkedAt": "2026-10-15"
    },
    {
      "id": "x-skills",
      "url": "https://github.com/sergebulaev/x-skills",
      "author": "sergebulaev",
      "license": "MIT. Post, thread and review structure only; no skill text or publisher copied.",